Location, Link,Title,Description
Maine,http://www.hidinc.com/mainepmp,"Health Information Designs, LLC. Â» Maine PMP","This upgrade will cause a change in the current format of the weekly data report 
that ... Information Designs' Maine Prescription Monitoring Program Web Portal."
Maine,http://click.portlandmaine.gov/gisportal/,"City of Portland , Maine - City of Portland GIS","City of Portland Maine, Web Apps Â· PDF Maps Â· Mobile Apps ... 2012, Page 2 > Â· 
Complete City of Portland Demographics Â· Portlandmaine.gov Â· PortlandÂ ..."
Maine,http://www.nebhe.org/wp-content/uploads/Maine_Statewide_Longitudinal__Data_System.ppt,Maine Education Data Management System - New England Board ...,"Design, develop and implement a longitudinal data system that stakeholders can 
... Data Dictionary (F); Single Sign-on Portal (F); Data Warehouse â€“ PreK-20 (F)Â ..."
Maine,http://www.mainequalitycounts.org/image_upload/Maine%20PCMH%20Pilot%20Reports%20Portals%20Summary_06.13.pdf,Practice Report and Portal Summary - Maine Quality Counts,"Maine PCMH Pilot Portals & Reports. Report/. Portal. MAPCP RTI Portal ... 
MaineCare Health Homes initiative ... Centered Medical Home Data Collection 
and."
Montana,http://gisportal.msl.mt.gov/,Montana GIS Portal,"Montana's primary catalog of GIS data. Find Data You Need. Advanced Search. 
Search Tips. FAQ. Publish ... Metadata Writing Guide Â· Portal Metadata Standard
Â ..."
Montana,http://nris.mt.gov/gis/,Montana Geographic Information Clearinghouse - Natural Resource ...,"Please visit the new Montana State Library Geographic Information website: ... 
This is our new search interface for data available in the Montana GIS Portal."
Montana,http://cadastral.mt.gov/,Montana Cadastral Data,"Disclaimer: The Montana State Library (MSL) provides this product/service for 
informational purposes only. MSL did not produce it for, nor is it suitable for legal,
Â ..."
Montana,https://geoinfo.montanastatelibrary.org/,Geographic Information - Montana State Library,"Through federal tribal, state, and local inter-agency data coordination and 
partnerships. MSL develops and maintains an extensive collection of Montana'sÂ ..."
Montana,https://geoinfo.montanastatelibrary.org/data/msdi/,Montana Spatial Data Infrastructure (MSDI) | Geographic Information,"The Montana Spatial Data Infrastructure consists of digital statewide spatial data 
themes, vetted through the Montana State Library with the advice of theÂ ..."
Montana,http://geoinfo.montanastatelibrary.org/applications/,Applications - Geographic Information - Montana State Library,"Montana GIS Portal ... index of metadata files that may be used with Geographic 
Information System software to make maps or analyze location-based data."
Montana,http://geoinfo.montanastatelibrary.org/data/aerialphotos/,Aerial Photographs of Montana | Geographic Information,"Web Changes Â· Home â€º Data â€º Aerial Photographs of Montana ... Transportation. - 
Wetlands. Data. - GIS Data List. - Montana GIS Portal. - Web Services."
Montana,http://geoinfo.montanastatelibrary.org/geography/water/nhd/,Montana's National Hydrography Dataset | Geographic Information,"Go to the Montana NHD Data Download Page . Additionally, web map services 
are available for the NHD and watershed boundary dataset here: GIS Portal Web
Â ..."
Montana,https://itunes.apple.com/us/app/cencoos-data-portal-mobile/id443908044?mt=8,CeNCOOS Data Portal Mobile on the App Store on iTunes,"Nov 21, 2011... CeNCOOS Data Portal Mobile on the App Store. Download CeNCOOS Data 
Portal Mobile and enjoy it on your iPhone, iPad, and iPod touch."
Montana,http://www.nrcs.usda.gov/wps/portal/nrcs/main/mt/snow/,Montana Snow Survey Program - Natural Resources Conservation ...,"The NRCS Snow Survey Program provides mountain snowpack data and 
streamflow forecasts for the western United States. Common applications of snow
Â ..."
Nebraska,http://www.northeastoceandata.org/,Northeast Ocean Data Portal | Maps and data for ocean planning in ...,"Maritime Commerce. Energy. Recreation. Commercial Fishing. Aquaculture. Fish. 
Marine Mammals & Sea Turtles. Other Marine Life. Data ExplorerÂ ..."
Nebraska,http://www.nebraskamap.gov/,NebraskaMAP Nebraska GeoPortal,"State of Nebraska Government Web Site ... Likewise, data providers can use the 
geoportal to make their geospatial resources discoverable, viewable, andÂ ..."
Nebraska,https://portal.education.ne.gov/,Portal: Nebraska Department of Education,"The NonPublic Curriculum Reporting System is located under the Data 
Collections tab in the Portal. All NonPublic Systems must report. Audit window is 
March 1Â ..."
Nebraska,http://data.publichealthne.org/,PHAN - Public Health Association of Nebraska,"Welcome to the new Data Portal for the Public Health Association of Nebraska (
PHAN). Please familiarize yourself with the data and watch this space for newÂ ..."
Nebraska,http://www.nebraska.gov/data.html,Nebraska Government - State of Nebraska,"Nebraska State Data brought to YOU, the citizens of Nebraska, the information 
that matters most. Are you one of our government partners? A citizen with ideasÂ ..."
Nebraska,http://www.nebraska.gov/subscriber/,Nebraska.gov Subscriber - State of Nebraska,"New to subscriber portal? Home Â· How to ... Nebraska.gov provides services that 
simplify how you conduct business and interact with the State of Nebraska."
Nebraska,http://www.nebraska.gov/policies.html,"Security, Accessibility, and Privacy Policies - State of Nebraska","The State of Nebraska is committed to ensuring the integrity and security of the ... 
Data gathered through the state's official web site, or through portals or dataÂ ..."
Nebraska,http://digitalcommons.unl.edu/cgi/viewcontent.cgi?article=1313&context=libraryscience,geospatial data portals: librarians add expertise in the development ...,"Oct 1, 2010 ... In the development of NebraskaMAP, a statewide geospatial data ... and display 
capabilities of this geospatial data portal's metadata catalog."
Nebraska,http://digitalcommons.unl.edu/libraryscience/297/,"GEOSPATIAL DATA PORTALS: LIBRARIANS ADD EXPERTISE IN ...""","This paper describes the process of building a statewide geospatial data portal in 
Nebraska, and how the UNL Libraries contributed to the organization of theÂ ..."
Nebraska,http://serc.carleton.edu/NAGTWorkshops/gis/state_resources.html,State GIS Resources - SERC,"Dec 15, 2013... tabular and vector data via state clearinghouses, university libraries and ... 
Mississippi Missouri Montana Nebraska Nevada New HampshireÂ ..."
Nevada,http://sensor.nevada.edu/,Nevada Climate Change PortalWeb CamerasNevada Climate Change Portal - Nevada System of Higher EducationContact UsExplore NevadaData ResourcesThe Project,"As the name implies, the Nevada Climate Change Project is focused on 
collecting climate change data as it relates to the State of Nevada. Detailed 
informationÂ ...Web Cameras. Site Camera Thumbnail. 
Sheep Range Creosotebush:.The Nevada Climate Change Project is 
dedicated to advancing not only the 
frontiers of ... To this end, a number of 
educational materials are made 
available thatÂ ...Contact Us Â· Home ... Contact. The 
Nevada Climate Change Project is 
dedicated to scientific collaboration and 
publicÂ ...Explore Nevada. EPSCoR. Data analysis visualization. ... The Nevada Climate 
Change Portal has been designed to use the latest web technology: HTML 5.Data Resources. The Nevada Climate 
Change Project is focused on collecting
Â ...The Project. Nevada Infrastructure for 
Climate Change Science, Education,Â ..."
Nevada,http://digitalscholarship.unlv.edu/cgi/viewcontent.cgi?filename=0&article=1005&context=climate_change&type=additional,Nevada Climate Change Portal - Digital Scholarship@UNLV,"Climate Data: The Nevada Climate. Change Portal. Presented by Sergiu Dascalu
. University of Nevada Reno. Nevada Cyberinfrastructure Group. Las VegasÂ ..."
Nevada,http://digitalscholarship.unlv.edu/cgi/viewcontent.cgi?article=1066&context=focs_ug_research,Adaptation of the Nevada Climate Change Data Portal web interface ...,"Seeks to advance the quality and quantity of climate information pertaining to the 
state of Nevada. â€¢ Contains temperature and other measurement datapoints."
Nevada,http://www.diversifynevada.com/data-library,Diversify Nevada - Data Library,"Economic Indicator Data. Nevada Economic highlights. 2.8Million 2012. 1.0% vs. 
prior period. 1.2Million DECEMBER 2013. 1.2% vs. prior period. $3.7BillionÂ ..."
Nevada,http://www.cse.unr.edu/~dascalus/ITNG2013_IG.pdf,Web Portal Usability Tests for the Nevada Climate Change Portal,"in Figure 1, to deliver data about Nevada's environment to users through a web ... 
web portal in order to help guide developers to create a more useful and moreÂ ..."
Nevada,https://bighorn.doe.nv.gov/,Bighorn: Home,"Bighorn Portal. Message Center. If you have a Bighorn account but do not have 
access to the Nevada Growth Model website, please complete a Bighorn ... This 
discussion thread is about the SAIN data collection and integration processes."
Nevada,http://www.lasvegasnevada.gov/business/,Business (Official City of Las Vegas Web Site),"Open Data Portal ... of Commerce; Women's Chamber of Commerce; Nevada 
Development Authority ... 333 N. Rancho Drive Las Vegas, NV 89106 (Map)"
New Hampshire,http://www.nh.gov/epht/ehdin/,"Environmental Health Data Portal, New Hampshire ... - NH.gov","The Environmental Health Data Portal is NH's environmental public health 
tracking system. Is portal provides data about environmental hazards, exposures, 
andÂ ..."
New Hampshire,https://www.nh.gov/epht/,New Hampshire Environmental Public Health Tracking Program,"Feb 4, 2014 ... NH Environmental Public Health Tracking Program. Home Â· About Us Â· 
Environmental Health Data Portal Â· National Environmental PublicÂ ..."
New Hampshire,http://education.nh.gov/data/index.htm,Data and Records | NH Department of Education,"The Department has a significant number of data collection efforts in place to 
report ... Department of Education - an official New Hampshire Government 
website ... many of these data systems through the Department's web portal 
myNHDOE."
New Hampshire,http://www.nh.gov/epht/health/,"Health Effects, New Hampshire Environmental Public ... - NH.gov","... Health Data Portal Â· National Environmental Public Health Tracking Network ... 
indicators for New Hampshire are available on the NH EPHT Web Portal."
New Hampshire,http://en.wikipedia.org/wiki/Portal:New_Hampshire,"Portal:New Hampshire - Wikipedia, the free encyclopedia","New Hampshire is a state in the New England region of the northeastern United 
States. The state ranks 46th of the 50 states in land area and 41st in population."
New Hampshire,http://www.courts.state.nh.us/e-court/,New Hampshire Judicial Branch - AOC,"e-Portal is the capability for the public and litigants to access court files and court 
... e-Data Exchanges is the electronic transmission of data between agencies,Â ..."
New Hampshire,https://newhampshire.magellanmedicaid.com/,State of New Hampshire | Web Portal | Main,"Latest News. New Hampshire Medicaid has made some changes to the 
Preferred Drug List that will be effective on September 4, 2013. Please see the 
PreferredÂ ..."
New Hampshire,https://nhchis.com/,New Hampshire Comprehensive Health Care Information System,"The New Hampshire Comprehensive Health Care Information System (CHIS) 
was created by NH state statute to make health care data available as a 
resourceÂ ..."
New Hampshire,https://nhchis.com/NH/DataSubmission/FrequentlyAskedQuestion,Frequently Asked Questions - New Hampshire Comprehensive ...,"The details of problems associated with the data can be viewed by logging onto 
the secure online portal and looking at the entries associated with thatÂ ..."
New Hampshire,http://www.nrcs.usda.gov/wps/portal/nrcs/main/nh/soils,Information on New Hampshire Soils - Natural Resources ...,"Soil Data Mart (Soil Properties and Interpretations); New Hampshire Soil Data (
Important Farmland data and selected Soil Properties by county. Image of Marlow
Â ..."
New Jersey,http://www.nj.gov/njbusiness/,NJ Business Portal | Home - State of New Jersey,"Under Governor Christie's leadership, New Jersey has once again become an 
attractive place to do business. From Fortune 500 firms to small andÂ ..."
New Jersey,https://www.njportal.com/njsp/alcotest/,Alcotest Inquiry System - State of New Jersey,"Alcotest Inquiry is available to anyone who registers for an account. Potential 
users include attorneys, pro se filers, government agencies, trustees, dataÂ ..."
New Jersey,http://www.state.nj.us/dep/gis/,NJDEP GIS - State of New Jersey,"Nov 25, 2013 ... Hot Topics, Data News, & Updates Get Hot Topics, ... statewide: nj home | 
services A to Z | departments/agencies | FAQs Â· Environmental DigitalÂ ..."
New Jersey,http://www.app.com/section/DATA/DataUniverse,DataUniverse | The Asbury Park Press NJ | app.com,"Search New Jersey and U.S. public records for data on government spending 
and payrolls, schools, ... DataUniverse is your portal to public government data."
New Jersey,http://datamine2.state.nj.us/dep/DEP_OPRA/index2.html,NJDEP-Dataminer-Open Public Records Act,"Jan 10, 2014 ... Welcome to the New Jersey Department of Environmental Protection's online 
reports portal, NJDEP Data Miner. Within you will find a variety ofÂ ..."
New Jersey,http://www.mcatoolkit.org/Resources/US_State_Maps/Maps_New_Jersey.html,New Jersey Maps - Marine Conservation Agreements,"State Data Management: The New Jersey Office of GIS serves as the state ... 
Network (NJGIN) serves as the primary portal for public access to geospatial data
."
New Jersey,https://njgin.state.nj.us/,New Jersey Geographic Information Network,"Road Centerlines of New Jersey, New Jersey State Plane... New Jersey 2013 ... 
New Jersey Road Centerlines Data Updated January 31st, 2014 Â· ArcGIS 10.2Â ..."
New Jersey,http://newjersey.hometownlocator.com/nj/hunterdon/west-portal.cfm,"West Portal, NJ - New Jersey Gazetteer","West Portal Populated Place Profile with maps, aerial photos, schools, hospitals, 
... Location: Hunterdon County, NJ, FID: 881725, Latitude: 40.662322998, 
Longitude: ... BIG Map | Driving Directions | Data Source - USGS GNIS FID: 
881725."
New Jersey,http://www.sunviewer.net/portals/NJNG/,New Jersey National Guard - SunViewer.net,"Sunviewerâ„¢ portal for the New Jersey National Guard green energy project. 
Heliotronics Sunviewer.netâ„¢ web portals and SunTouchâ„¢ kiosks display live 
dataÂ ..."
New Jersey,http://portal.hud.gov/hudportal/HUD/states/new_jersey,HUD in New Jersey,"Featured Local News. Friday, January 10, 2014. HUD Awards Nearly $500,000 
to 9 New Jersey Public Housing Authorities to Promote Family Self-Sufficiency."
New Mexico,http://www.prweb.com/releases/2013/11/prweb11288761.htm,Paladin Data Systems Announces NewMARC Portal Awarded the ...,"Oct 31, 2013 ... Paladin Data Systems Announces NewMARC Portal Awarded the New Mexico 
Infrastructure Finance Conference's 2013 Best Practice AwardÂ ..."
New Mexico,http://sunshineportalnm.com/,New Mexico Sunshine Portal,"Mar 30, 2011 ... Come back often to see new reports, enhanced features, and fresh data! How do 
I use the Sunshine Portal? To jump-start your search, click onÂ ..."
New Mexico,http://landstatus.nmstatelands.org/GISDataDownLoadnew.aspx,New Mexico State Land Office - Enterprise Data,These data are produced and maintained by the New MexicoÂ ...
New Mexico,http://octane.nmt.edu/,Go Tech,"GO-TECH is up and running at a new location. ... if you have a request regarding 
the data that is normally available on this site from the New Mexico State LandÂ ..."
New Mexico,http://www.stateintegrity.org/new_mexico_governor_susana_martinez_sunshine_portal_employee_data,"New Mexico announces overhaul of Sunshine Portal"" employee data""","Governor Susana Martinez announced today that her administration has 
completed an overhaul of the New Mexico Sunshine Portal, which now displays 
theÂ ..."
New Mexico,https://nmtracking.org/,Welcome to New Mexico Environmental Public Health Tracking,"Find maps of New Mexico Counties, Health Regions and Legislative House and 
... Access state data and create maps, charts, and tables on the public portal."
New Mexico,http://nmepscor.org/,nmepscor.org |,"Data Portal ... New Mexico's Experimental Program to Stimulate Competitive 
Research ... NM EPSCoR is also cultivating a well-qualified Science, Technology
,Â ..."
New Mexico,https://ibis.health.state.nm.us/resources/Injury_Portal.html,NM-IBIS - New Mexico Injury Portal,"Sep 14, 2013 ... This page provides links to documents and resources for injury data in New 
Mexico. Click on a blue bar to expand it to see the content."
New Mexico,http://smiley.nmsu.edu/SparcWebsite/sparcgisresources.htm,GIS Resources - New Mexico State University,"GIS Resources. Internet Mapping Resource and Data Portal. This portal provides 
access to Currently Supported data downloads and Internet Mapping Services."
New Mexico,http://news.unm.edu/news/a-portal-for-earth-science-data-exploration,A Portal for Earth Science Data Exploration :: The University of New ...,"Jul 23, 2012 ... Science is entering a new era of data intensive research says William ... 
DataONE principal investigator at the University of New Mexico."
New York,https://nycopendata.socrata.com/,NYC Open Data,"Read the full article: â€ùHow New York's Fire Department Uses Data Miningâ€ù .... a 
running count of datasets, maps, and charts available on the OpenData portal."
New York,https://data.ny.gov/,Open Data: State of New York,"Welcome to New York's Open Data Portal, bringing together local, state and 
federal data in one place. Search the site's datasets by location or subject,Â ..."
New York,http://www.nyc.gov/html/dcp/html/neigh_info/nhmap.shtml,Community District Information - New York City Department of City ...,"Community Data Portal Â· Printer Friendly Version. NYC Community Data Portal. 
For information about a particular community district, select from the map below:Â ..."
New York,http://www.nyc.gov/html/doitt/html/open/data.shtml,DoITT - Technology & Public Service Innovation - Open Data,"Through New York City's open data policy â€“ a citywide set of standards and 
guidelines ... APIs (application programming interface) through its Developer 
Portal."
New York,http://www.engageny.org/portal,EngageNY Portal | EngageNY,"The goals of the EngageNY Portal are to: Make student data available to New 
York's educators, students, and students' families to support improved instruction
Â ..."
New York,https://data.cityofnewyork.us/browse?limitTo=datasets,Datasets - Search & Browse | NYC Open Data,"Public data sets made available on the NYC OpenData portal are provided for ... 
New York City school level College Board SAT results for the graduatingÂ ..."
New York,https://nycbigapps.com/datasets,NYC BigApps 2013 Data Sets,"New York State's Open Data Portal brings together local, state and federal data in 
one place. Search the site's datasets by location or subject, or explore featuredÂ ..."
New York,http://www.thenewyorkworld.com/2013/11/22/open-data/,City agencies slow flow of data to public hub | The New York World,"Nov 22, 2013 ... In one sense it's news to celebrate: Since the passage of New York ... Agencies 
must upload all such data to the portal by the end of 2018."
New York,http://nys-its.github.io/open-data-handbook/,Open Data Handbook - New York State Office of Information ...,"The Open New York web portal will allow researchers, citizens, business and the 
media direct access to high-value data, which will be continually added to andÂ ..."
New York,http://www.itworld.com/big-data/401196/rats-open-data-tells-new-york-city-residents-where-vermin-are-and-aren-t,Rats! Open data tells New York City residents where the vermin are ...,"Jan 22, 2014 ... The Big Apple's Rat Information Portal is an early example of a government using 
open data in a creative way."
North Carolina,http://www.cgia.state.nc.us/DataResources.aspx,NC GIS Data Resources,"Now, we are pleased to offer data-distribution through the NC OneMap 
GeoSpatial Portal. Visit the Geospatial Portal to discover data, download data, or 
streamÂ ..."
North Carolina,http://data.nconemap.com/,NC OneMap GeoSpatial Portal,"How to use OGC services; Search the GeoSpatial Portal with a browser ... NC 
OneMap GeoSpatial Portal - Geographic Data Serving a Statewide Community ::."
North Carolina,http://www.nconemap.com/,NC OneMap > Home,"The official site of NC OneMap. ... Visit the Geospatial Portal to discover data, 
download data, or stream data through a web service directly into a desktop or 
webÂ ..."
North Carolina,https://www.communitycarenc.org/informatics-center/north-carolina-community-health-information-portal/,CCNC : North Carolina Community Health Information Portal,"New insights through the geo-location of data. The North Carolina Community 
Health Information Portal (NC-HIP) is a web-based application designed to allow
Â ..."
North Carolina,http://www.raleighnc.gov/open,Open Raleigh | raleighnc.gov - City of Raleigh,"Aug 21, 2013 ... The Open Data Institute awarded a pilot level certificate to Raleigh's Open Data 
Portal. Open Data Portal. Screenshot of Open Data Portal. Learn about your city 
through Raleigh's Open Data Portal Data. ... Raleigh, NC 27601Â ..."
North Carolina,https://data.raleighnc.gov/,Open Raleigh,"Daily Police Incident Data: Updated every day at 11AM. Historic District Overlay 
... Land Use in 2012. Permit data with parcel ID for 2012 and up to 02/08/2013Â ..."
North Carolina,http://www.nc.gov/government/stats.aspx,NC.gov: Statistics and Research,"North Carolina Capital ... Education Data: Financial, school, business, key annual 
reports, longitudinal trends for K-12 Â· Get the Facts on Community CollegesÂ ..."
North Carolina,http://www.unc.edu/~kapark/CURS/intro.html,NC Cities - The University of North Carolina at Chapel Hill,"The State of North Carolina Cities (SNCC) Data Portal is a long-term initiative 
developed to inform citizens and policymakers about the changes occurring inÂ ..."
North Carolina,http://www.ncdenr.gov/,NC Dept. of Environment and Natural Resources: NCDENR,"NC DENR .... Data, Statistics, Reports and Maps ... N.C. DENR Regional Offices 
map - Select a regional office near you or click on a region on the map above toÂ ..."
North Carolina,http://www.socrata.com/blog/raleigh-nc-wins-national-award-for-open-data-portal/,"Raleigh, NC Wins National Award for Open Data Portal - Socrata","Aug 28, 2013 ... Raleigh, NC received a 2013 Web 2.0 award for its open data portal. With events 
like NC DataJam and NC DataPalooza, Raleigh aims toÂ ..."
North Dakota,https://apps.nd.gov/hubdataportal,North Dakota GIS Hub Data Portal - Job Service North Dakota,"The GIS Hub is the portal to North Dakota geospatial data. The data, web 
services, and interactive maps available on the GIS Hub are the results of aÂ ..."
North Dakota,https://gf.nd.gov/maps/gis-hub-data-portal,GIS Hub Data Portal | North Dakota Game and Fish,"The North Dakota GIS Hub Data Portal is a tool for finding downloadable GIS 
data, GIS web services, and GIS applications using geographic extents, 
searchingÂ ..."
North Dakota,http://www.nd.gov/gis/,North Dakota GIS (Geographic Information Systems),Portal to North Dakota geospatial data and information.
North Dakota,http://www.nd.gov/gis/mapsdata/,Maps and Data - State of North Dakota,"North Dakota GIS (Geographic Information Systems) ... nd.gov - The Official 
Portal for North Dakota State Government Â· North Dakota: Legendary. Follow the 
trailÂ ..."
North Dakota,https://apps.nd.gov/hubdataportal/srv/en/metadata.show?currTab=simple&id=137,North Dakota GIS Hub Data Portal - Job Service North Dakota,"Presentation form, Digital map: Map represented in raster or vector form. Abstract, 
This data set contains imagery from the National Agricultural Imagery ProgramÂ ..."
North Dakota,https://apps.nd.gov/hubdataportal/srv/en/metadata.show?currTab=simple&id=99,Ground and Surface Water Data - North Dakota GIS Hub Data Portal,"The GIS Hub is the portal to North Dakota geospatial data. The data, web ... 
Organisation name, North Dakota State Water Commission. Role, Originator: 
PartyÂ ..."
North Dakota,https://apps.nd.gov/hubdataportal/srv/en/metadata.show?currTab=simple&id=54,National Grasslands - North Dakota GIS Hub Data Portal - State of ...,"The GIS Hub is the portal to North Dakota geospatial data. The data, web 
services, and interactive maps available on the GIS Hub are the results of aÂ ..."
North Dakota,https://apps.nd.gov/hubdataportal/srv/en/help,North Dakota GIS Hub Data Portal,"The GIS Hub is the portal to North Dakota geospatial data. The data, web 
services, and interactive maps available on the GIS Hub are the results of aÂ ..."
North Dakota,https://apps.nd.gov/hubdataportal/srv/en/metadata.show?currTab=simple&id=57,US Army Corps of Engineers Lands - North Dakota GIS Hub Data ...,"The GIS Hub is the portal to North Dakota geospatial data. The data, web 
services, and interactive maps available on the GIS Hub are the results of aÂ ..."
North Dakota,http://www.nd.gov/gis/mapsdata/data/extractdata/,Finding And Obtaining Data From The GIS Hub - State of North Dakota,"Vector and raster data stored on the GIS Hub can be downloaded using the Hub 
Data Portal which is the primary application for finding and downloading data."
Ohio,http://education.ohio.gov/Topics/Data/Data-Tools-Portal/Data-Tools-Home,Data Tools Portal - Ohio Department of Education,"Ohio Department of Education Â· Facebook Â· Twitter Â· LinkedIn Â· YouTube ... Data 
Tools Home. Public; Teacher ... Review financial data. District Fiscal Benchmark
Â ..."
