Location, Link,Title,Description
Florida,http://www.dep.state.fl.us/air/air_data_portal/level_one_select.htm,Air Data Portal - Florida Department of Environmental Protection,"Welcome to the Division of Air Resource Management air data portal. Please 
contact us if you require any assistance or would like to request additional 
features."
Georgia,http://gce-lter.marsci.uga.edu/portal/monitoring.htm,Georgia Coastal Ecosystems LTER Data Portal,"Welcome to the GCE Data Portal - A browsable catalog of data sets and plots ... 
and GCE-affiliated monitoring programs operating near Sapelo Island, GeorgiaÂ ..."
Georgia,http://www.city-data.com/city/Portal-Georgia.html,"Portal, Georgia (GA 30450) profile: population ... - City-Data.com","Submit your own pictures of this town and show them to the World Click here for 
promotion details and to upload your Portal, Georgia photos. OSM Map; General
Â ..."
Georgia,https://portal.doe.k12.ga.us/,Portal .doe.k12.ga.us - Georgia Department of Education,"MyGaDOE Online Guide Â· GaDOE Public Website Â· Information Systems Â· AYP & 
NCLB Â· Georgia Standards Â· Data Collections Â· Financial Reports Â· Report CardÂ ..."
Georgia,http://gaassessors.com/,Georgia Tax Assessors - Your One Stop Portal to Assessment ...,"Georgia Tax Assessors - Your One Stop Portal to Assessment, Parcel Data & GIS 
for ... Search parcel data, tax digest & GIS maps by Owners Name, LocationÂ ..."
Georgia,http://gaassessors.com/georgia-map.html,Georgia Tax Assessors - Your One Stop Portal to Assessment ...,"Georgia County Tax Assessor websites by Map: Georgia Tax Assessors - Your 
One Stop Portal to Assessment, Parcel Data & GIS for. Alphabetical listing ofÂ ..."
Georgia,http://gaassessors.com/body-p.html,P - Georgia Tax Assessors - Your One Stop Portal to Assessment ...,"Welcome to Georgia Assessors! Georgia Assessors is your doorway to all 
Georgia County websites for on-line Parcel, Tax & GIS Data. Search parcel data, 
taxÂ ..."
Georgia,http://gaassessors.com/body-t.html,Georgia Tax Assessors - Your One Stop Portal to Assessment ...,"Search parcel data, tax digest & GIS maps by Owners Name, Location Address, 
Parcel Number, Legal Description, ... Georgia County Tax Assessor websites"
Georgia,http://gaassessors.com/body-c.html,C - Georgia Tax Assessors - Your One Stop Portal to Assessment ...,"Search parcel data, tax digest & GIS maps by Owners Name, Location Address, 
Parcel ... Georgia County Tax Assessor websites ... WOODBINE GA 31569"
Georgia,http://georgia.hometownlocator.com/ga/bulloch/portal.cfm,"Portal, Georgia GA Community Profile / Bulloch County, GA Data","Portal, Georgia GA Community Profile with maps, aerial photos, schools, 
hospitals, airports, real estate MLS listings and local jobs. Bulloch County, FID: 
332735,Â ..."
Georgia,https://communities.socrata.com/catalog/ndoch-macon/,Middle GA National Day of Civic Hacking | Socrata Community Data ...,"We're the extension of the National Day of Civic Hacking for all of central Georgia
. Armed with hackers and challenges, we aim to go to work on some of the bigÂ ..."
Hawaii,https://data.hawaii.gov/,Open Data: HawaiiAboutpage9,"The redesign and relaunch of Hawaii's Open Data Portal brings new features and 
new tools to open data. New charting libraries and new mapping tools allowÂ ...About this Site. With the launch of the 
State of Hawaii's Open Data portal, theÂ ...explore.data.gov ... Hawaii State Departments, Counties and Important Offices 
This data is leveraged in the Hawaii State Portal at ... Use of Open Data Portal."
Hawaii,http://www.uhero.hawaii.edu/6/data,Data | UHERO,"The UHERO Data Portal provides access to is a wide array of economic and 
social indicators for the State of Hawaii, the four counties and key externalÂ ..."
Hawaii,http://www.uhero.hawaii.edu/,UHERO: Home,"... through rigorous, independent economic research on the people, environment 
and economies of Hawaii and the Asia Pacific region. ... DATA PORTALÂ ..."
Hawaii,http://uhero.prognoz.com/,UHERO Data Portal - At a Glance,"NonFarm Jobs (Thou.), 2012. Statewide At a Glance. Indicators. Source. 2007. 
2008. 2009. 2010. 2011. 2012. NonFarm Jobs (Thou.) 624.9. 619.2. 591.5. 586.9."
Hawaii,http://www.hawaiifreepress.com/ArticlesMain/tabid/56/ID/8238/Hawaii-Open-Data-Portal-Launched.aspx,Hawaii Open Data Portal Launched > Hawaii Free Press,"Nov 17, 2012 ... State of Hawaii has now begun providing residents, analysts, and civic 
developers with unparalleled access to State data ...."
Hawaii,https://portal.ehawaii.gov/page/subscriber-services/,hawaii.gov | Subscriber Services,"Companies who purchase lists of bulk data (businesses, licensees) for ... who 
conduct large numbers of HawaiÊ»i background checks using our eCrim service."
Hawaii,https://portal.ehawaii.gov/page/design/,hawaii.gov | Our Design,"Hawaii.gov is designed for mobile with a touch-first Responsive web design. ... 
sets a new standard and the first of its kind â€” a data-driven, touch-enabled portal
."
Idaho,https://fishandgame.idaho.gov/ifwis/portal/,Idaho Fish and Wildlife Information System | ifwis,"The Idaho Fish and Wildlife Information System (IFWIS) is a comprehensive ... 
Login to see all of the Portal ... Idaho State Ranks - in need of Bird Data."
Idaho,https://www.sde.idaho.gov/site/isee/,Idaho State Department of Education - Idaho System for Educational ...,"The Idaho State Department of Education has deployed the Idaho System for 
Educational Excellence (ISEE), a K-12 Longitudinal Data System that supports 
ourÂ ..."
Idaho,http://gis.idaho.gov/portal/datamaps.html,Data and Maps - Idaho Geospatial Office - Idaho.gov,"Idaho's official geospatial data portal is INSIDE Idaho. As Framework elements 
become available, metadata and links to the web service and download areÂ ..."
Idaho,https://sites.google.com/a/isu.edu/epscor-data-portal-idaho,EPSCoR Data Portal Idaho - Google Sites,Collaborative Data Sharing Site for Idaho EPSCoR Participants.
Idaho,http://www.idahoepscor.org/DrawNKNSearch.aspx?PageID=261,Data Portal - Idaho EPSCoR,"Increased Bandwidth Will Help University of Idaho Researchers Share, Move 
Data Paul Gessler, Luke Sheneman Â· More newsÂ ..."
Idaho,http://www.idahoepscor.org/uploads/NKN%20Cataloging%20Instructions.pdf,Instructions for Contributing EPSCoR Data and ... - Idaho EPSCoR,"The Northwest Knowledge Network (NKN) data portal was developed, in part, ... 
to be in compliance with the official Idaho NSF EPSCoR data sharing policy,."
Idaho,http://www.idahoepscor.org/DrawOnePage.aspx?PageID=195,Idaho NSF EPSCoRIdaho EPSCoR Data Products,"Downscaled Climate Model Output for the Salmon River Basin, Idaho from 
WCRP ... To access the NW Knowledge Network (NKN) data portal, (BETA 
version)Â ..."
Idaho,https://www.northwestknowledge.net/,Welcome to the Northwest Knowledge Network (NKN) | NKN Portal,"NKN Portal ... The Gordon and Betty Moore Foundation's Data-Driven Discovery 
... Provides access to information about water issues in key Idaho river basinsÂ ..."
Idaho,https://www.northwestknowledge.net/node/120,Nov 11: NKN - a resource for Idaho researchers | NKN Portal,"Nov 11, 2013 ... From the Idaho EPSCoR newsletter (Fall 2013): ... The NKN data portal also 
provides resources to help researchers tag their data withÂ ..."
Idaho,http://www.idahoednews.org/news/state-seeking-to-solve-schoolnet-problems/,State seeking to solve Schoolnet problems | Idaho Education News,"Dec 5, 2013 ... Districts have been feeding student information into Schoolnet by way of a 
second state data portal: the Idaho System for EducationalÂ ..."
Illinois,http://ddip.lth5.k12.il.us/,Illinois Data Portal > Home,"Welcome! The Illinois Data Driven Instruction Portal is a free instructional data 
collection and reporting resource for districts and schools in Illinois. The purpose
Â ..."
Illinois,https://data.illinois.gov/,Data.Illinois.gov | Open Illinois,"This data contains rest area related information such as services available, 
location information, location and rest area name. The data is intended to provide
Â ..."
Illinois,https://techpresident.com/short-post/illinois-launches-open-data-portal,Illinois Launches Open Data Portal | TechPresident,"Jun 22, 2011 ... The state of Illinois has launched an open data portal that uses the Socrata 
platform, Socrata announced yesterday in a press release."
Illinois,https://datacatalog.cookcountyil.gov/,"Data | Cook County, Illinois","... Elected Officials Serving Cook County cook county map of elected officials. 
This Data Set contains a GIS/Map of Elected Officials in Cook County. 2,150 
viewsÂ ..."
Illinois,http://hackforchange.org/resource/state-illinois-data-portal,State of Illinois Data Portal | National Day of Civic Hacking,"Link to a file, API or website: State of Illinois Data Portal. Sponsorship. There are 
many ways in which you or your organization can support National Day of CivicÂ ..."
Illinois,https://data.cityofchicago.org/,Data Portal: City of Chicago,"Current police beat boundaries in Chicago. The data can be viewed on the 
Chicago Data Portal with a web browser. However, to view or use the files 
outside ofÂ ..."
Illinois,http://www.ilcto.org/News/illlinoisdataportal,Illlinois Data Portal - Illinois Chief Technology Officers,"Sep 14, 2012 ... Illinois Data Portal (IDP) collection tools will assist districts in gaining a 
comprehensive picture for longâ€êterm planning, district. improvementÂ ..."
Illinois,http://ceedchicago.csw.uic.edu/index.php?option=com_content&view=article&id=223:illinois-data-portal&catid=76&Itemid=114,Illinois Data Portal,"Organization: Illinois Data Portal. Home page: https://data.illinois.gov/. 
Description: Illinois Data Portal brings interactive information from the State's 
variousÂ ..."
Illinois,http://datacatalogs.org/dataset/state_of_illinois@2011-07-05T09%3A16%3A24.015081,State of Illinois Data Portal - Data Catalogs - datacatalogs.org,"Homepage, http://data.illinois.gov/. Description. Open Data Portal for the State of 
Illinois. Publisher, State of Illinois. Metadata License, -. Spatial CoverageÂ ..."
Illinois,http://www.arcgis.com/home/item.html?id=525624aee3cb473ab119f7fcbf100649,ArcGIS.com | Web Map - Illinois Data Portal Map Demo,"title: Illinois Data Portal Map Demo. description: null. type: Web Map. tags: Illinois 
Data Portal Ethnicity Tax. thumbnail: Illinois Data Portal Map Demo."
Indiana,http://gis.iu.edu/,Indiana Spatial Data Portal (ISDP) - Indiana UniversitySingle File Download InferfaceView DataDownload DataSupport & InfoISPD Multi-file Download ToolIndiana Spatial Data Portal ...,"Welcome to gis.iu.edu. The Indiana Spatial Data Portal (ISDP) provides access to 
more than 30 terabytes of Indiana geospatial data. Most datasets are availableÂ ...Indiana Spatial Data Portal. Select a 
USGS quadrangle name from the list or
Â ...View Data Â· Online Viewer; Online Map 
Services Â· GIS Connection Â· DownloadÂ ...Home Â» Download Data Â». Download 
Data. Single File Â· ISPD Multi-file ToolÂ ...... GIS Resources at IU Â· GIS at IU Â· GIS 
Day Â· Home Â» Support & Info Â»Â ...ISDP Multi-file Download Tool 2.1. 
checkbox arrow Â· Download Tool (
665KBÂ ...Indiana Spatial Data Portal Viewer. 
Zoom In. Zoom Out. Full Extent. Prev 
Extent."
Indiana,http://www.indianamap.org/,IndianaMAP,"Welcome to IndianaMap. IndianaMAP is the largest publicly available collection 
of Indiana geographic information system (GIS) map data. It is made possible by
Â ..."
Indiana,http://www.indianamap.org/resources.php,Data and Resources - IndianaMAP,"DATA â€“ Download GIS data for Indiana ... (HTML,TXT,XML) Â· IndianaMap Open 
Topography (Indiana LiDAR data ) Â· Indiana Spatial Data Portal Â· IndianaViewÂ ..."
Indiana,https://data.southbendin.gov/,Open Data Portal - City of South Bend,"Welcome to the South Bend Open Data Portal. Freely accessible and transparent 
municipal data from the City of South .... 2013 City of South Bend, Indiana."
Indiana,http://www.in.gov/gis/datashare.htm,GIS: Data Sharing - State of Indiana,"Indiana has created a model for the nation of how to share and distribute state 
and local data sets. This benefits Hoosiers by saving substantial tax payer funds
Â ..."
Indiana,http://www.in.gov/itp/,Transparency: ITP - State of Indiana,"The Indiana Transparency Portal (ITP) is designed to give you, the Indiana ... In 
this portal users will find data on economic development projects that IEDCÂ ..."
Indiana,http://www.libraries.iub.edu/index.php?pageId=1002181,Union List of Sanborn Maps - Indiana University Libraries,"Aug 30, 2013 ... A 2011 IndianaView grant funded the archiving of the digital maps on the Indiana 
Spatial Data Portal. Most pre-1923 maps have been digitizedÂ ..."
Iowa,http://www.idph.state.ia.us/DWH/,IDPH Data Warehouse - Iowa Department of Public Health,"Due to the launch of the new Public Health Tracking portal, the current Data 
Warehouse will no longer be available as of November 1, 2013. Access to theÂ ..."
Iowa,https://www.educateiowa.gov/data-reporting/iowa-education-portal-information,Iowa Education Portal Information | Iowa Department of Education,"Data & Reporting ... The Iowa Education Portal continues its rollout for educators 
in Iowa and will provide one common location for Department of EducationÂ ..."
Iowa,http://www.govtech.com/policy-management/Iowa-Voter-Data-Portal-Real-Time-View.html,Iowa Voter Data Portal Offers Real-Time View,"Apr 5, 2012 ... Iowa Voter Data Portal Offers Real-Time View. Election Day information simplifies 
voting process and illuminates voter activity. by Noelle KnellÂ ..."
Iowa,https://iris.iowa.gov/,Iowa Immunization Registry Information System .. [Portal Main Page],"Welcome to Iowa's Immunization Registry Information System (IRIS)! Posted on 
11/24/2010. If you are an authorized user, please login using your uniqueÂ ..."
Iowa,http://iconsortium.subst-abuse.uiowa.edu/webportal/data_sets.htm,Iowa PIC Web Portal -- Data Sets,"For assorted government statistics: www.fedstats.gov. US Census Bureau data 
archives: www.census.gov. US Bureau of Labor Statistics: www.bls.gov"
Iowa,http://www.igsb.uiowa.edu/nrgislibx/,Welcome to the NRGIS Library - Iowa Geological and Water Survey ...,"Iowa Geological and Water Survey Â· Iowa DNR ... County-wide Data. Data 
available by County Â· Data available by ... Regional Iowa Data. Data Available by 
IowaÂ ..."
Iowa,https://www.environmental.iowadot.gov/LogIn.aspx,(OLE) GIS Project Portal - Iowa Department of Transportation,"Map graphic and text data in a web-based Geographic Information System (GIS) 
are representations or copies of original data sources, and are provided toÂ ..."
Iowa,http://www.iowadot.gov/gis/default.htm,Geospatial Technologies - Iowa Department of Transportation,"2012 GIMS data is available in shapefile format Â· 2012 Trails in shapefile format Â· 
2014-2018 Program Management (5 Year) in shapefile and KMZ formats Â· 2011Â ..."
Iowa,http://www.governing.com/news/politics/gt-iowa-voter-data-portal-with-real-time-view.html,Iowa Counties Use Voter Data Portal With Real-Time View - Governing,"Apr 6, 2012 ... Cerro Gordo County built a precinct election management system that is now 
used by more than 50 Iowa counties. Constructed by internal ITÂ ..."
Iowa,https://www.iowagisdata.org/,Welcome to iowagisdata.org!,"IowaGISData.org is developed and sponsored by the Iowa Counties Information 
... as well as other agencies, to share GIS data for emergency management andÂ ..."
Kansas,https://data.kcmo.org/,Open Data | data.kcmo.org,"Federated Domains. icon This site only; icon data.mo.gov ... 2012 City of Kansas 
City, Mo. Legal Notice Â· Privacy Â· Contact Us Â· Powered by Socrata."
Kansas,http://www.ipsr.ku.edu/ksdata/ksah/portal.shtml,Kansas Data Portal - Institute for Policy & Social Research - The ...,"This portal will allow you to explore the data in the Kansas Data Archive. Menus 
and links below will let you switch from map, trend graph (link in each countyÂ ..."
Kansas,http://cfakc.tumblr.com/post/48864799701/open-data-in-kansas,Open Data in Kansas - Code for America: Team Kansas City,"Open Data in Kansas By Andrew Hyder Kansas City is serious about becoming 
the ... As Kansas City, Missouri has also recently put online an open data portal,Â ..."
Kansas,https://data.mo.gov/Agriculture/Kansas-City-Farmer-s-Markets/7y25-ms5b,Kansas City Farmer's Markets - State of Missouri Data Portal,"Nov 26, 2013 ... Kansas City Farmer's Markets .... The Socrata Open Data API (SODA) allows 
software developers to access data hosted in Socrata data sitesÂ ..."
Kansas,http://www.ksde.org/default.aspx?tabid=54,User Log In - Kansas State Department of Education,"... Tiered System of Supports (MTSS) Â· Kansas Parent Information Resource 
Center Â· Kansas Technical Assistance System Network (TASN) Â· Data and 
ReportsÂ ..."
Kansas,https://www.data.gov/open-gov/,Open Government | Data.gov,"Since his first full day in office, President Obama has prioritized making 
government more open and accountable and has taken substantial steps to 
increaseÂ ..."
Kansas,http://www.codeforamerica.org/cities/kansascity/,Kansas City | Code for America,"In 2013 Kansas City, Missouri put its open data portal online and Kansas City, 
Kansas passed a resolution to begin doing the same. Also in 2013, the Code for
Â ..."
Kansas,http://www.socrata.com/blog/data-action-qa-kansas-city-missouri/,"Data in Action: Q&A with Kansas City, Missouri - Socrata","Feb 6, 2014 ... 2) How long did it take Kansas City to get from no performance data to where you 
are .... Raleigh, NC Wins National Award for Open Data Portal."
Kansas,http://www.socrata.com/pages/open-data-headlines-socrata-april-2013/,"Open Data Headlines @ Socrata | April 2013 - Socrata, Inc.","Kansas City, Mo. made a bold statement when it launched its new open data 
portal, offering multiple views of just one data set. Many successful portals started
Â ..."
Kansas,http://www.kansas.gov/employee/,State of Kansas Employee Service Center - Kansas.gov,"Kansas Photos ... in order to ensure the integrity of employee data, we made the 
decision to expire ... Send employee portal comments to EMPPortal@da.ks.govÂ ..."
Kentucky,http://cpe.ky.gov/info/,Kentucky Postsecondary Education Data Portal - Council on ...,"The Kentucky Council on Postsecondary Education maintains a wide range of 
research and data from postsecondary institutions across Kentucky, and this 
pageÂ ..."
Kentucky,http://kygeonet.ky.gov/geographicexplorer/,Kentucky Geography Network :: Geoportal,"The Kentucky Geoportal is an award-winning Data Clearinghouse that provides 
easy and convenient ways to discover and share geospatial data resources."
Kentucky,http://kygeonet.ky.gov/,Kentucky Geography Network,"Kentucky's GIS users now have another base map option that focuses primarily 
on ... of the Kentucky Geoportal to locate maps and geographic data content for a
Â ..."
Kentucky,http://data.louisvilleky.gov/,Data Portal | LouisvilleKy.gov: Search & Browse Datasets and Views,"Louisville, KY OpenData - About the Data. Louisville Metro Government is 
committed to increasing the openness and transparency of government. See our 
newÂ ..."
Kentucky,http://kgs.uky.edu/kgsmap/KGSGeoPortal/KGSGeoPortal.asp,KGSGeoPortal - Kentucky Geological Survey - University of Kentucky,"Instructions. Use the links below to open a map or data service to the displayed 
map extent: Data searches yield tabular results, and on large areas may yieldÂ ..."
Kentucky,http://www.uky.edu/KGS/gis/kgs_gis.html,KGS GIS Data - University of Kentucky,"Jan 13, 2005 ... Geospatial Data Library. The Kentucky Geological Survey and other state and 
federal agencies have electronic maps and GIS data that youÂ ..."
Kentucky,http://data.lexingtonky.gov/,Lexington's Open Data Portal: LexingtonKy.gov,"Welcome to Lexington's open data portal, a collaborative effort between LFUCG 
and the community. Our mission is to promote the openness, transparency andÂ ..."
Kentucky,http://kentucky.gov/education/Pages/default.aspx,Kentucky.gov Education,"School Improvement provides a data-driven, research-based framework for 
defining goals and objectives for improving student ... Virtual Library Portal for 
Kids."
Kentucky,http://www.kypvas.com/,Kentucky Property Valuation Administrators - Your One Stop Portal ...,"Welcome to Kentucky Assessors! Kentucky Assessors is your doorway to all 
Kentucky County websites for on-line Parcel, Tax & GIS Data. Search parcel data
Â ..."
Kentucky,http://www.lanereport.com/29372/2014/02/kentucky-transportation-cabinet-launches-datamart-web-portal/,Kentucky Transportation Cabinet launches 'DataMart' Web portal,"Feb 7, 2014 ... A new Web portal, Kentucky Transportation Cabinet DataMart, puts a wealth of ... 
â€œWe're excited to launch our Data Mart,â€ù said TransportationÂ ..."
Louisiana,http://egis3.lacounty.gov/dataportal/,LA County GIS Data Portal - Los Angeles County Enterprise GIS,"The LA County GIS Data Portal is the place to search for and download GIS data 
created, maintained, licensed, and stored by the County of Los Angeles. PleaseÂ ..."
Louisiana,http://egis3.lacounty.gov/dataportal/tag/gis-data/,GIS Data | Los Angeles County GIS Data Portal,"Updated December 2013. LA City Council Districts as adopted by Final 
Ordinance 2012 No. 182168. This data was provided by the City of Los Angeles."
Louisiana,http://www.socrata.com/newsroom-article/city-of-los-angeles-launches-new-open-data-portal/,City of Los Angeles Launches New Open Data Portal - Socrata,"Dec 5, 2013 ... Los Angeles City Controller Ron Galperin and open data solutions company ... 
an open data and financial transparency portal, ControlPanel LA."
Louisiana,http://www.esri.com/news/arcwatch/0111/feature.html,Port of Los Angeles Unifies Operations with Data Portal - Esri,"The IT division knew that a simple intranet data portal, combined with the police 
... A significant portion of data at the Port of LA is dynamic information, not justÂ ..."
Louisiana,http://map.la.gov/,LouisianaMap - Louisiana's Geospatial Portal-L03,"May 19, 2011 ... LouisianaMAP is the official mapping portal for Louisiana government. With this 
... The geographic data available from this site is managed andÂ ..."
Louisiana,http://www.louisianasiteselection.com/gis-data-download.aspx,Louisiana GIS Data Download - Louisiana Site Selection Center,"Geospatial Data Download Portal. biologic. Get Entire Folder (8.73 MB) Â· 
Metadata Â· Geodatabase (8.68 MB). Name, Link, Size in KB. Marsh Vegetation 
TypesÂ ..."
Louisiana,http://www.theatlanticcities.com/housing/2013/10/neighborhood-data-portal-every-city-needs/7291/,The Neighborhood Data Portal Every City Needs - The Atlantic Cities,"Oct 18, 2013 ... As the open data movement has matured, public city-wide vital stats have ... Just 
a sampling of the dozens of metrics, via the portal from the L.A.Â ..."
Louisiana,https://data.cityofchicago.org/,Data Portal: City of Chicago,"Current police beat boundaries in Chicago. The data can be viewed on the 
Chicago Data Portal with a web browser. However, to view or use the files 
outside ofÂ ..."
Louisiana,http://www.qpublic.net/la/Louisiana-map.html,Louisiana Tax Assessors - Your One Stop Portal to ... - qPublic,"Welcome to Louisiana Assessors! Louisiana Assessors is your doorway to all 
Louisiana Parish websites for on-line Parcel, Tax & GIS Data. Search parcel data
Â ..."
Louisiana,https://controllerdata.lacity.org/,Open Data: Los Angeles,"With billions of gigabytes of data created every day, we have a historic 
opportunity ... And for the City of Los Angeles, Smart Data starts here: at 
ControlPanel LA."
Maine,https://gateway.maine.gov/cognos/cgi-bin/cognosisapi.dll?b_action=cognosViewer&ui.action=run&ui.object=%2Fcontent%2Ffolder%5B%40name%3D'CDC%20EOHP%20EPHT%20AVR'%5D%2FreportView%5B%40name%3D'Maine%20Environmental%20Public%20Health%20Tracking%20(EPHT)%20Network%20-%20Public%20Data%20Portal'%5D&cv.header=false&cv.toolbar=false,Data Portal - Maine.gov,"Maine Tracking Network. A partner in the ... Public Data Portal ... View health and 
environmental data for selected environmental hazards and health effects."
Maine,https://data.mainepublichealth.gov/tracking/portal-content,About the Data Portal - Maine Center for Disease Control & Prevention,"Since launching in 2009 with just a few topics, the Maine Tracking Network data 
portal has continued to expand, and now includes the topics listed below."
Maine,https://data.mainepublichealth.gov/tracking/home,Your Connection to Maine Environmental Public Health Data ...,"Go to the Maine Tracking Network data portal to: View health and environmental 
data; Search for health and environmental data for your county or public healthÂ ..."
Maine,http://www.neracoos.org/realtime_map,Real-Time Data Portal | Northeastern Regional Association of ...,"Real-Time Data Portal ... Gulf of Maine Buoys, Long Island Sound ... Due to 
atmospheric or other conditions, latest data may not always be available. 
NOTICE:Â ..."
Maine,http://www.gulfofmaine-census.org/data-mapping/data-and-mapping-portal/,Data and Mapping Portal Â» Gulf of Maine Census,"Welcome to the data and mapping portal for the Gulf of Maine Census. Here, you 
can explore, download and map biological and physical data from multipleÂ ..."
Maine,http://www.gulfofmaine-census.org/data-mapping/,Data & Mapping Â» Gulf of Maine Census,"Mapping technology is likewise an invaluable tool for synthesis, analysis, and 
visualization of research data. Our data and mapping portal, the Biogeographical
Â ..."
